summary,description,priority_name,issuetype_name,project_key,project_category_name,summary_char_count,summary_word_count,description_char_count,description_word_count,has_description,labels_count,has_assignee,votes_votes,watches_watch_count,created_year,created_month,duration_category
Change XmlFormattingOptions to not do anything by default,"Changing XmlFormattingOptions to not do anything by default to help improve minor compatibility and gain a ""cheap"" performance benefit (up to 2% overall). While it's a nice feature to have, it may be unexpected for some clients to leave out the XML declaration. Furthermore, while the indenting is beneficial for debugging, generally people will not be reading the XML. The change should be relatively simple I think: {code} if (formatingOptions != null) { JAXBUtils.setXmlFormattingOptions(marshaller, formatingOptions); } else { JAXBUtils.setXmlFormattingOptions(marshaller, XmlFormattingOptions .getDefaultXmlFormattingOptions()); } {code} should get rid of the else statement. This would allow the marshaller to do whatever the ""natural"" JDK defaults are automatically.",Major,Improvement,WINK,Unknown,57,8,773,104,1,0,1,0.0,0.0,2009,9,Standard
Make OM KeyDeletingService compatible with HA model,"Currently OM KeyDeletingService directly deletes all the keys in DeletedTable after deleting the corresponding blocks through SCM. For HA compatibility, the key purging should happen through the OM Ratis server. This Jira introduces PurgeKeys request in OM protocol. This request will be submitted to OMs Ratis server after SCM deletes blocks corresponding to deleted keys.",Major,Sub-task,HDDS,Ozone,51,7,373,55,1,1,1,0.0,3.0,2019,7,Standard
Registering JDBC driver not needed in test and runtime as it is added in META-INF/services,,Unknown,Task,PHOENIX,Phoenix,90,15,0,0,0,0,0,0.0,1.0,2014,3,Standard
EC2 create security group error,"While preparing an application to support jclouds-1.6.2, testing against RC1, I discovered that when using AWS EC2 and invoking createNodesInGroup(...) with a group name not used before, jclouds will cause AWS to emit an error ""InvalidGroupId.Malformed"" when invoking API call AuthorizeSecurityGroupIngress. This problem does *not* occur in 1.6.1-incubating. Example: TemplateOptions options = computeService.templateOptions() .blockOnPort(22, 600) .inboundPorts(22, 80); Template template = computeService.templateBuilder() .options(options) .build(); Set<? extends NodeMetadata> nodes = computeService.createNodesInGroup(""a-never-seen-before-group-name"", 1, template); Outcome: Here is an extract from the jclouds log: (a bigger log extract is attached) 62496|DEBUG|main |org.jclouds.rest.internal.InvokeSyncToAsyncHttpMethod |>> invoking AuthorizeSecurityGroupIngress 62499|DEBUG|main |org.jclouds.http.internal.JavaUrlHttpCommandExecutorService|Sending request -1187121582: POST https://ec2.us-east-1.amazonaws.com/ HTTP/1.1 62499|DEBUG|main |jclouds.wire |>> ""Action=AuthorizeSecurityGroupIngress&GroupId=jclouds%23richard-new-group3&IpPermissions.0.FromPort=80&IpPermissions.0.IpProtocol=tcp&IpPermissions.0.IpRanges.0.CidrIp=0.0.0.0/0&IpPermissions.0.ToPort=80&IpPermissions.1.FromPort=22&IpPermissions.1.IpProtocol=tcp&IpPermissions.1.IpRanges.0.CidrIp=0.0.0.0/0&IpPermissions.1.ToPort=22&IpPermissions.2.FromPort=0&IpPermissions.2.Groups.0.GroupName=jclouds%23richard-new-group3&IpPermissions.2.Groups.0.UserId=761990928256&IpPermissions.2.IpProtocol=tcp&IpPermissions.2.ToPort=65535&IpPermissions.3.FromPort=0&IpPermissions.3.Groups.0.GroupName=jclouds%23richard-new-group3&IpPermissions.3.Groups.0.UserId=761990928256&IpPermissions.3.IpProtocol=udp&IpPermissions.3.ToPort=65535&Signature=8TclhF%2Bm78/A8sbqAArV5FiAjw/s61tDyRHWbaVmNlY%3D&SignatureMethod=HmacSHA256&SignatureVersion=2&Timestamp=2013-08-14T15%3A09%3A12.069Z&Version=2012-06-01&AWSAccessKeyId=AKIAJN65AYF37RPSZB5A"" 62499|DEBUG|main |jclouds.headers |>> POST https://ec2.us-east-1.amazonaws.com/ HTTP/1.1 62499|DEBUG|main |jclouds.headers |>> Host: ec2.us-east-1.amazonaws.com 62499|DEBUG|main |jclouds.headers |>> Content-Type: application/x-www-form-urlencoded 62499|DEBUG|main |jclouds.headers |>> Content-Length: 922 62653|DEBUG|main |org.jclouds.http.internal.JavaUrlHttpCommandExecutorService|Receiving response -1187121582: HTTP/1.1 400 Bad Request 62653|DEBUG|main |jclouds.headers |<< HTTP/1.1 400 Bad Request 62653|DEBUG|main |jclouds.headers |<< Transfer-Encoding: chunked 62653|DEBUG|main |jclouds.headers |<< Date: Wed, 14 Aug 2013 15:09:11 GMT 62653|DEBUG|main |jclouds.headers |<< Cneonction: close 62653|DEBUG|main |jclouds.headers |<< Server: AmazonEC2 62653|DEBUG|main |jclouds.headers |<< Content-Type: application/unknown 62654|DEBUG|main |jclouds.wire |<< ""<?xml version=""1.0"" encoding=""UTF-8""?>[\n]"" 62654|DEBUG|main |jclouds.wire |<< ""<Response><Errors><Error><Code>InvalidGroupId.Malformed</Code><Message>Invalid id: ""jclouds#richard-new-group3"" (expecting ""sg-..."")</Message></Error></Errors><RequestID>91ad5fb8-3e93-4566-8d6e-952518c766d8</RequestID></Response>"" com.google.common.util.concurrent.UncheckedExecutionException: java.lang.IllegalArgumentException: Invalid id: ""jclouds#richard-new-group3"" (expecting ""sg-..."") After the test, seems that the security group is created but ingress rules are not configured. Running the test for a second time, jclouds sees that the security group exists so does not attempt to create or configure it. Therefore, on the second run, the test fails because it is unable to get access to port 22. --- This may be caused by the changes in commit 7ac0d37 for JCLOUDS-99. This is invoking this API call: securityClient.authorizeSecurityGroupIngressInRegion(region, name, perms); However, inspecting the definition of this API call, it takes a security group *id* - not a name. This code is sending the name instead of the ID, and AWS rejects it as being an unknown ID. It seems that confusion has been caused by the definitions of authorizeSecurityGroupIngressInRegion. In the class SecurityGroupAsyncClient, both methods by this name take the group *name* as a parameter. It is subclassed by AWSSecurityGroupAsyncClient which adds two more authorizeSecurityGroupIngressInRegion methods, that take the group *id* as a parameter. This is obviously a very confusing inconsistency!",Blocker,Bug,JCLOUDS,jclouds,31,5,4415,359,1,0,1,0.0,4.0,2013,8,Short
Refactor MiniClusterExtension,,Major,Bug,FLINK,Flink,29,2,0,0,0,1,1,0.0,1.0,2022,2,Standard
Dataset lookup is failing in GDS policy,"In GDS policy, while selecting Dataset, Dataset lookup is failing with NullPointerException",Major,Sub-task,RANGER,Ranger,39,7,91,12,1,0,0,0.0,1.0,2023,9,Long-running
Add utility to get current username,Currently we lie about what user is running the connection. We should make a better effort.,Major,Sub-task,HBASE,Hadoop,35,6,91,16,1,0,1,0.0,2.0,2016,4,Short
Update documentation on use of Locale parameters,"Need to update API wiki docs with Locale parameter info, and also add something to the plugin developers guide",Major,Sub-task,WOOKIE,Incubator,48,7,110,19,1,0,0,0.0,0.0,2010,1,Standard
Internal tree builder,"As a followup to OAK-3 and as [discussed|http://markmail.org/message/uficvjx35cxy5h4i] on oak-dev@, I'd like to introduce an internal abstraction for constructing new and modified content trees.",Major,New Feature,OAK,Jackrabbit,21,3,194,24,1,0,1,0.0,0.0,2012,3,Long-running
[MR-279] OutputCommitter changes for MR Application Master recovery,"In MR AM recovers from a crash, it only reruns the non completed tasks. The completed tasks (along with their output, if any) needs to be recovered from the previous life. This would require some changes in OutputCommitter.",Blocker,Sub-task,MAPREDUCE,Hadoop,67,8,223,38,1,0,1,0.0,6.0,2011,7,Long-running
WebHCat listing jobs after the given JobId even when templeton.jobs.listorder is set to lexicographicaldesc,"HIVE-11724 introduced new setting to change the order of jobs listed. In-cases where ""templeton.jobs.listorder"" is set to lexicographicaldesc, filtering based on jobid still returning values greater then given job if, where as less than are expected. Its a code bug.",Major,Bug,HIVE,Hadoop,107,14,266,40,1,0,1,0.0,2.0,2015,10,Standard
Implement deleteProfileProperties mutation,,Major,Sub-task,UNOMI,Unomi,42,3,0,0,0,0,1,0.0,1.0,2020,2,Standard
findbugs.sh will -1 if there are no java source code in the module.,"In MAPREDUCE-6595, I'm seeing ""-1 findbugs"" in hadoop-mapreduce-project module. There are no java source code in the module and that's why {{mvn findbugs:findbugs}} does not output {{target/findbugsXml.xml}}. {noformat} -1 findbugs 3m 34s patch/hadoop-mapreduce-project no findbugs output file (hadoop-mapreduce-project/target/findbugsXml.xml) {noformat}",Major,Bug,YETUS,Yetus,67,13,354,39,1,0,1,0.0,2.0,2016,1,Standard
WinSDK script fails - Proton components have moved,Script cpp\bld-windsk.ps1 fails to delete Proton components in Proton 0.9 since components have moved. Proton is an optional component and the script error could be fixed by making the references to Proton conditional - if the component exists then delete it else mush on.,Major,Bug,QPID,Qpid,50,8,272,44,1,0,1,0.0,3.0,2015,3,Short
Create layer between the ws and the persisence to handle the object conversion,This is conversion of uddiv3 objects to persistence objects and back.,Major,Task,JUDDI,Retired,78,13,69,11,1,0,1,0.0,0.0,2008,9,Long-running
[pack] acceptance test of transaction failure and successful compensation scenario,,Major,Sub-task,SCB,Incubator,82,10,0,0,0,0,1,0.0,2.0,2018,1,Standard
Remove deprecated format readers and writer,,Minor,Improvement,OPENNLP,OpenNLP,43,6,0,0,0,0,1,0.0,2.0,2017,1,Short
Constant folding should happen before PCR,"So, that partition pruning and transitive predicate propagation may take advantage of constant folding.",Major,Improvement,HIVE,Hadoop,41,6,103,14,1,0,1,0.0,3.0,2014,10,Standard
Shared work optimizer should check residual predicates when comparing joins,,Major,Bug,HIVE,Hadoop,75,10,0,0,0,0,1,0.0,3.0,2020,3,Standard
Modify Merge statement logic to perform Update split early,,Major,Sub-task,HIVE,Hadoop,58,9,0,0,0,0,1,0.0,4.0,2019,1,Standard
protocol-okhttp: properly record HTTP version in request message header,"The HTTP version in the request message tracked by the plugin protocol-okhttp ({{store.http.request=true}}) is not the version sent in the request but that received from the response. Note that the HTTP version sent in the request may differ from that sent back in the response. One example (tracked using wget): {noformat} > wget -d https://www.kp.ru/daily/27061/4129507/ ... ---request begin--- GET /daily/27061/4129507/ HTTP/1.1 User-Agent: Wget/1.20.3 (linux-gnu) Accept: */* Accept-Encoding: identity Host: www.kp.ru Connection: Keep-Alive ---request end--- HTTP request sent, awaiting response... ---response begin--- HTTP/1.0 200 OK ... {noformat} protocol-http uses the response version (""HTTP/1.0"") also for the request: {noformat} > bin/nutch parsechecker -Dstore.http.headers=true -Dstore.http.request=true \ -Dplugin.includes='protocol-okhttp|parse-html' https://www.kp.ru/daily/27061/4129507/ ... _request_=GET /daily/27061/4129507/ HTTP/1.0 ... _response.headers_=HTTP/1.0 200 OK ... {noformat} The protocol-http tracks the versions correctly: {noformat} > bin/nutch parsechecker -Dstore.http.headers=true -Dstore.http.request=true \ -Dplugin.includes='protocol-http|parse-html' https://www.kp.ru/daily/27061/4129507/ ... _request_=GET /daily/27061/4129507/ HTTP/1.1 ... _response.headers_=HTTP/1.0 200 OK ... {noformat}",Minor,Bug,NUTCH,Nutch,71,9,1334,140,1,1,1,0.0,3.0,2019,12,Long-running
[UI] UI changes to be align with service latest api,need UI changes corresponding to changes in PR: https://github.com/apache/incubator-griffin/pull/320,Major,Improvement,GRIFFIN,Incubator,51,10,100,9,1,0,1,0.0,1.0,2018,6,Standard
Add retries for edge label creation,"Concurrent operations will fail when trying to create edge label which tries to define a new property key for the edge label if it doesnt exist. {noformat} 2016-08-15 04:08:28,475 DEBUG - [pool-8-thread-1:] ~ Adding a new trait=PII for entity=b1630277-e8dc-4fcf-94af-c0c8b0b51c09 (GraphBackedMetadataRepository:222) 2016-08-15 04:08:28,476 DEBUG - [pool-8-thread-2:] ~ Adding a new trait=PII for entity=5e335fed-4a74-496d-8521-1678caf85813 (GraphBackedMetadataRepository:222) 2016-08-15 04:08:28,477 DEBUG - [pool-8-thread-1:] ~ Finding vertex with __guid = b1630277-e8dc-4fcf-94af-c0c8b0b51c09, (GraphHelper:182) 2016-08-15 04:08:28,477 DEBUG - [pool-8-thread-2:] ~ Finding vertex with __guid = 5e335fed-4a74-496d-8521-1678caf85813, (GraphHelper:182) 2016-08-15 04:08:28,477 DEBUG - [pool-8-thread-3:] ~ Executing dsl query=hive_table (GraphBackedDiscoveryService:133) 2016-08-15 04:08:28,483 DEBUG - [pool-8-thread-2:] ~ Found a vertex vertex[id=8704 type=hive_database guid=5e335fed-4a74-496d-8521-1678caf85813] with __guid = 5e335fed-4a74-496d-8521-1678caf85813, (GraphHelper:192) 2016-08-15 04:08:28,484 DEBUG - [pool-8-thread-2:] ~ Creating vertex for type PII id null (GraphHelper:97) 2016-08-15 04:08:28,485 DEBUG - [pool-8-thread-2:] ~ Setting property __typeName = ""PII"" to vertex[id=8960 type=null guid=null] (GraphHelper:290) 2016-08-15 04:08:28,487 DEBUG - [pool-8-thread-2:] ~ Set property __typeName = ""PII"" to vertex[id=8960 type=null guid=null] (GraphHelper:300) 2016-08-15 04:08:28,487 DEBUG - [pool-8-thread-2:] ~ Setting property __state = ""ACTIVE"" to vertex[id=8960 type=PII guid=null] (GraphHelper:290) 2016-08-15 04:08:28,488 DEBUG - [pool-8-thread-2:] ~ Set property __state = ""ACTIVE"" to vertex[id=8960 type=PII guid=null] (GraphHelper:300) 2016-08-15 04:08:28,488 DEBUG - [pool-8-thread-1:] ~ Found a vertex vertex[id=8448 type=hive_database guid=b1630277-e8dc-4fcf-94af-c0c8b0b51c09] with __guid = b1630277-e8dc-4fcf-94af-c0c8b0b51c09, (GraphHelper:192) 2016-08-15 04:08:28,488 DEBUG - [pool-8-thread-2:] ~ Setting property __timestamp = ""1471234108488"" to vertex[id=8960 type=PII guid=null] (GraphHelper:290) 2016-08-15 04:08:28,489 DEBUG - [pool-8-thread-1:] ~ Creating vertex for type PII id null (GraphHelper:97) 2016-08-15 04:08:28,490 DEBUG - [pool-8-thread-2:] ~ Set property __timestamp = ""1471234108488"" to vertex[id=8960 type=PII guid=null] (GraphHelper:300) 2016-08-15 04:08:28,490 DEBUG - [pool-8-thread-2:] ~ Setting property __modificationTimestamp = ""1471234108488"" to vertex[id=8960 type=PII guid=null] (GraphHelper:290) 2016-08-15 04:08:28,490 DEBUG - [pool-8-thread-1:] ~ Setting property __typeName = ""PII"" to vertex[id=9216 type=null guid=null] (GraphHelper:290) 2016-08-15 04:08:28,490 DEBUG - [pool-8-thread-2:] ~ Set property __modificationTimestamp = ""1471234108488"" to vertex[id=8960 type=PII guid=null] (GraphHelper:300) 2016-08-15 04:08:28,491 DEBUG - [pool-8-thread-2:] ~ created vertex vertex[id=8960 type=PII guid=null] for trait PII (TypedInstanceToGraphMapper:665) 2016-08-15 04:08:28,492 DEBUG - [pool-8-thread-2:] ~ Mapping instance struct[type=PII] to vertex vertex[id=8960 type=PII guid=null] (TypedInstanceToGraphMapper:181) 2016-08-15 04:08:28,492 DEBUG - [pool-8-thread-2:] ~ Setting property __modificationTimestamp = ""1471234108488"" to vertex[id=8960 type=PII guid=null] (GraphHelper:290) 2016-08-15 04:08:28,492 DEBUG - [pool-8-thread-2:] ~ Finding edges for vertex[id=8960 type=PII guid=null] with label hive_database.PII (GraphHelper:201) 2016-08-15 04:08:28,493 DEBUG - [pool-8-thread-2:] ~ Adding edge for vertex[id=8704 type=hive_database guid=5e335fed-4a74-496d-8521-1678caf85813] -> label hive_database.PII -> vertex[id=8960 type=PII guid=null] (GraphHelper:122) 2016-08-15 04:08:28,493 DEBUG - [pool-8-thread-1:] ~ Set property __typeName = ""PII"" to vertex[id=9216 type=null guid=null] (GraphHelper:300) 2016-08-15 04:08:28,494 DEBUG - [pool-8-thread-1:] ~ Setting property __state = ""ACTIVE"" to vertex[id=9216 type=PII guid=null] (GraphHelper:290) 2016-08-15 04:08:28,495 DEBUG - [pool-8-thread-3:] ~ Query = hive_table limit 10 offset 0 (GraphBackedDiscoveryService:158) 2016-08-15 04:08:28,495 DEBUG - [pool-8-thread-3:] ~ Expression Tree = LimitExpression 10, 0 ClassExpression hive_table (GraphBackedDiscoveryService:159) 2016-08-15 04:08:28,496 DEBUG - [pool-8-thread-3:] ~ Gremlin Query = L:{_var_0 = [] as Set;g.V().has(""__typeName"", ""hive_table"").fill(_var_0);g.V().has(""__superTypeNames"", ""hive_table"").fill(_var_0);_var_0._() [0..<10].toList()} (GraphBackedDiscoveryService:160) 2016-08-15 04:08:28,495 DEBUG - [pool-8-thread-1:] ~ Set property __state = ""ACTIVE"" to vertex[id=9216 type=PII guid=null] (GraphHelper:300) 2016-08-15 04:08:28,497 DEBUG - [pool-8-thread-1:] ~ Setting property __timestamp = ""1471234108497"" to vertex[id=9216 type=PII guid=null] (GraphHelper:290) 2016-08-15 04:08:28,499 DEBUG - [pool-8-thread-2:] ~ Setting property __state = ""ACTIVE"" to edge[id=1f0g-6ps-5slx-6ww label=hive_database.PII from vertex[id=8704 type=hive_database guid=5e335fed-4a74-496d-8521-1678caf85813] -> to vertex[id=8960 type=PII guid=null]] (GraphHelper:290) 2016-08-15 04:08:28,500 DEBUG - [pool-8-thread-2:] ~ Set property __state = ""ACTIVE"" to edge[id=1f0g-6ps-5slx-6ww label=hive_database.PII from vertex[id=8704 type=hive_database guid=5e335fed-4a74-496d-8521-1678caf85813] -> to vertex[id=8960 type=PII guid=null]] (GraphHelper:300) 2016-08-15 04:08:28,500 DEBUG - [pool-8-thread-1:] ~ Set property __timestamp = ""1471234108497"" to vertex[id=9216 type=PII guid=null] (GraphHelper:300) 2016-08-15 04:08:28,500 DEBUG - [pool-8-thread-2:] ~ Setting property __timestamp = ""1471234108488"" to edge[id=1f0g-6ps-5slx-6ww label=hive_database.PII from vertex[id=8704 type=hive_database guid=5e335fed-4a74-496d-8521-1678caf85813] -> to vertex[id=8960 type=PII guid=null]] (GraphHelper:290) 2016-08-15 04:08:28,501 DEBUG - [pool-8-thread-2:] ~ Set property __timestamp = ""1471234108488"" to edge[id=1f0g-6ps-5slx-6ww label=hive_database.PII from vertex[id=8704 type=hive_database guid=5e335fed-4a74-496d-8521-1678caf85813] -> to vertex[id=8960 type=PII guid=null]] (GraphHelper:300) 2016-08-15 04:08:28,501 DEBUG - [pool-8-thread-1:] ~ Setting property __modificationTimestamp = ""1471234108497"" to vertex[id=9216 type=PII guid=null] (GraphHelper:290) 2016-08-15 04:08:28,501 DEBUG - [pool-8-thread-2:] ~ Setting property __modificationTimestamp = ""1471234108488"" to edge[id=1f0g-6ps-5slx-6ww label=hive_database.PII from vertex[id=8704 type=hive_database guid=5e335fed-4a74-496d-8521-1678caf85813] -> to vertex[id=8960 type=PII guid=null]] (GraphHelper:290) 2016-08-15 04:08:28,501 DEBUG - [pool-8-thread-2:] ~ Set property __modificationTimestamp = ""1471234108488"" to edge[id=1f0g-6ps-5slx-6ww label=hive_database.PII from vertex[id=8704 type=hive_database guid=5e335fed-4a74-496d-8521-1678caf85813] -> to vertex[id=8960 type=PII guid=null]] (GraphHelper:300) 2016-08-15 04:08:28,502 DEBUG - [pool-8-thread-1:] ~ Set property __modificationTimestamp = ""1471234108497"" to vertex[id=9216 type=PII guid=null] (GraphHelper:300) 2016-08-15 04:08:28,502 DEBUG - [pool-8-thread-2:] ~ Added edge[id=1f0g-6ps-5slx-6ww label=hive_database.PII from vertex[id=8704 type=hive_database guid=5e335fed-4a74-496d-8521-1678caf85813] -> to vertex[id=8960 type=PII guid=null]] (GraphHelper:129) 2016-08-15 04:08:28,502 DEBUG - [pool-8-thread-1:] ~ created vertex vertex[id=9216 type=PII guid=null] for trait PII (TypedInstanceToGraphMapper:665) 2016-08-15 04:08:28,503 DEBUG - [pool-8-thread-2:] ~ Adding property __traitNames = ""PII"" to vertex vertex[id=8704 type=hive_database guid=5e335fed-4a74-496d-8521-1678caf85813] (GraphHelper:329) 2016-08-15 04:08:28,503 DEBUG - [pool-8-thread-1:] ~ Mapping instance struct[type=PII] to vertex vertex[id=9216 type=PII guid=null] (TypedInstanceToGraphMapper:181) 2016-08-15 04:08:28,504 DEBUG - [pool-8-thread-2:] ~ Setting property __modificationTimestamp = ""1471234108488"" to vertex[id=8704 type=hive_database guid=5e335fed-4a74-496d-8521-1678caf85813] (GraphHelper:290) 2016-08-15 04:08:28,504 DEBUG - [pool-8-thread-1:] ~ Setting property __modificationTimestamp = ""1471234108497"" to vertex[id=9216 type=PII guid=null] (GraphHelper:290) 2016-08-15 04:08:28,505 DEBUG - [pool-8-thread-2:] ~ Set property __modificationTimestamp = ""1471234108488"" to vertex[id=8704 type=hive_database guid=5e335fed-4a74-496d-8521-1678caf85813] (GraphHelper:300) 2016-08-15 04:08:28,505 DEBUG - [pool-8-thread-1:] ~ Finding edges for vertex[id=9216 type=PII guid=null] with label hive_database.PII (GraphHelper:201) 2016-08-15 04:08:28,506 DEBUG - [pool-8-thread-1:] ~ Adding edge for vertex[id=8448 type=hive_database guid=b1630277-e8dc-4fcf-94af-c0c8b0b51c09] -> label hive_database.PII -> vertex[id=9216 type=PII guid=null] (GraphHelper:122) 2016-08-15 04:08:28,532 ERROR - [pool-8-thread-1:] ~ graph rollback due to exception (GraphTransactionInterceptor:48) org.apache.atlas.repository.RepositoryException: com.thinkaurelius.titan.core.SchemaViolationException: Adding this property for key [system%&%SchemaName] and value [rt%hive_database.PII] violates a uniqueness constraint [SystemIndex#system%&%SchemaName] at org.apache.atlas.repository.graph.GraphBackedMetadataRepository.addTrait(GraphBackedMetadataRepository.java:243) at org.apache.atlas.GraphTransactionInterceptor.invoke(GraphTransactionInterceptor.java:42) at org.apache.atlas.repository.graph.GraphBackedMetadataRepositoryTest$1.call(GraphBackedMetadataRepositoryTest.java:155) at java.util.concurrent.FutureTask$Sync.innerRun(FutureTask.java:334) at java.util.concurrent.FutureTask.run(FutureTask.java:166) at java.util.concurrent.ThreadPoolExecutor.runWorker(ThreadPoolExecutor.java:1145) at java.util.concurrent.ThreadPoolExecutor$Worker.run(ThreadPoolExecutor.java:615) at java.lang.Thread.run(Thread.java:722) Caused by: com.thinkaurelius.titan.core.SchemaViolationException: Adding this property for key [system%&%SchemaName] and value [rt%hive_database.PII] violates a uniqueness constraint [SystemIndex#system%&%SchemaName] at com.thinkaurelius.titan.graphdb.transaction.StandardTitanTx.addPropertyInternal(StandardTitanTx.java:740) at com.thinkaurelius.titan.graphdb.transaction.StandardTitanTx.setProperty(StandardTitanTx.java:778) at com.thinkaurelius.titan.graphdb.transaction.StandardTitanTx.addProperty(StandardTitanTx.java:696) at com.thinkaurelius.titan.graphdb.transaction.StandardTitanTx.makeSchemaVertex(StandardTitanTx.java:815) at com.thinkaurelius.titan.graphdb.transaction.StandardTitanTx.makeEdgeLabel(StandardTitanTx.java:839) at com.thinkaurelius.titan.graphdb.types.StandardEdgeLabelMaker.make(StandardEdgeLabelMaker.java:88) at com.thinkaurelius.titan.graphdb.blueprints.BlueprintsDefaultSchemaMaker.makeEdgeLabel(BlueprintsDefaultSchemaMaker.java:23) at com.thinkaurelius.titan.graphdb.transaction.StandardTitanTx.getOrCreateEdgeLabel(StandardTitanTx.java:920) at com.thinkaurelius.titan.graphdb.blueprints.TitanBlueprintsTransaction.addEdge(TitanBlueprintsTransaction.java:132) at com.thinkaurelius.titan.graphdb.blueprints.TitanBlueprintsTransaction.addEdge(TitanBlueprintsTransaction.java:124) at com.thinkaurelius.titan.graphdb.blueprints.TitanBlueprintsGraph.addEdge(TitanBlueprintsGraph.java:250) at com.thinkaurelius.titan.graphdb.blueprints.TitanBlueprintsGraph.addEdge(TitanBlueprintsGraph.java:27) at org.apache.atlas.repository.graph.GraphHelper.addEdge(GraphHelper.java:123) at org.apache.atlas.repository.graph.GraphHelper.getOrCreateEdge(GraphHelper.java:145) at org.apache.atlas.repository.graph.TypedInstanceToGraphMapper.mapTraitInstanceToVertex(TypedInstanceToGraphMapper.java:672) at org.apache.atlas.repository.graph.GraphBackedMetadataRepository.addTrait(GraphBackedMetadataRepository.java:231) ... 7 more 2016-08-15 04:08:28,536 INFO - [pool-8-thread-2:] ~ graph commit (GraphTransactionInterceptor:44) {noformat}",Major,Bug,ATLAS,Incubator,35,6,11924,936,1,0,1,0.0,3.0,2016,8,Short
"Update themes to use ""provider"" architecture, similar to charts",,Minor,Improvement,PIVOT,Pivot,63,9,0,0,0,0,1,0.0,0.0,2009,4,Short
Upgrade Execute: support service groupings in upgrade engine,"Once the backend can support groupings, alter the engine to generate tasks in grouping order.",Major,Technical task,AMBARI,Ambari,60,8,93,15,1,0,1,0.0,2.0,2014,11,Standard
Reduce directory iterations in sidebar check,Implement [this comment|https://github.com/apache/ozone-site/pull/84#discussion_r1516738454] by Attila from HDDS-9866.,Major,Sub-task,HDDS,Ozone,44,6,118,7,1,1,1,0.0,1.0,2024,3,Standard
Test ZooKeeper 3.5 support,"Setup a Flink cluster with ZooKeeper 3.5 and run some HA tests on it (killing processes, failing jobs).",Critical,Sub-task,FLINK,Flink,26,4,103,18,1,1,1,0.0,1.0,2020,5,Standard
