summary,description,priority_name,issuetype_name,project_key,project_category_name,summary_char_count,summary_word_count,description_char_count,description_word_count,has_description,labels_count,has_assignee,votes_votes,watches_watch_count,created_year,created_month,duration_category
LP Bug: 1400963 - OEW test with T2 multithread cored at NAList<CollationDB*>::removeCounted,"Javabench OEW test was run thru T2 using multiple threads and this is the stack for one of the cores : #0 0x00000033632328e5 in raise () from /lib64/libc.so.6 #1 0x000000336323404d in abort () from /lib64/libc.so.6 #2 0x00007fde3e3938c5 in os::abort(bool) () from /home/trafodion/JavaBench-0.3.5/java/jdk1.7.0_60/jre/lib/amd64/server/libjvm.so #3 0x00007fde3e513bc7 in VMError::report_and_die() () from /home/trafodion/JavaBench-0.3.5/java/jdk1.7.0_60/jre/lib/amd64/server/libjvm.so # 4 0x00007fde3e3987cf in JVM_handle_linux_signal () from /home/trafodion/JavaBench-0.3.5/java/jdk1.7.0_60/jre/lib/amd64/server/libjvm.so #5 <signal handler called> #6 0x00007fde05d14f85 in NAList<CollationDB*>::removeCounted ( this=0x7fde060c0f40, elem=@0x7fde075632d8, desiredCount=<value optimized out>) at ../common/Collections.cpp:934 #7 0x00007fde00013ca3 in remove (this=0x7fddf6a323a8, __in_chrg=<value optimized out>) at ../common/Collections.h:1997 #8 ~CollationDB (this=0x7fddf6a323a8, __in_chrg=<value optimized out>) at ../common/charinfo.h:429 #9 SchemaDB::~SchemaDB (this=0x7fddf6a323a8, __in_chrg=<value optimized out>) at ../optimizer/SchemaDB.cpp:164 #10 0x00007fde00013fa1 in SchemaDB::~SchemaDB (this=0x7fddf6a323a8, __in_chrg=<value optimized out>) at ../optimizer/SchemaDB.cpp:164 #11 0x00007fde060f2530 in CmpContext::~CmpContext (this=0x7fddf6a2d090, __in_chrg=<value optimized out>) at ../arkcmp/CmpContext.cpp:333",Critical,Bug,TRAFODION,Retired,91,12,1422,119,1,0,1,0.0,2.0,2015,7,Long-running
AbstractListChromosome should support a constructor that does not copy,"AbstractListChromosome always copies the input arguments to a new list in its constructor. At the same time, subclasses implementing newFixedLengthChromosome() create a new instance with a new list, thus the list has to be created twice, which is inefficient.",Minor,Improvement,MATH,Commons,70,9,259,39,1,0,0,0.0,1.0,2013,12,Long-running
camel-spring-rabbitmq: Add usePublisherConnection option,Add usePublisherConnection option to allow developers to configure underlying RabbitTemplate usePublisherConnection property.,Major,Improvement,CAMEL,Camel,56,4,125,12,1,0,0,0.0,1.0,2021,1,Short
New annotations @Decorate and @Advise to identify methods that decorate or annotate services,"This would be similar to (and reuse logic from, one would hope) the @Contribute annotation.",Minor,Improvement,TAP5,Tapestry,92,13,91,15,1,0,1,1.0,1.0,2010,9,Long-running
YARN tests fail on Rackspace,See WHIRR-612 for details.,Major,Bug,WHIRR,Retired,28,5,26,4,1,0,1,0.0,2.0,2012,8,Short
ptest uses invalid killall command,killall -q -9 -f java -f is an invalid flag,Major,Sub-task,HIVE,Hadoop,34,5,43,10,1,0,0,0.0,1.0,2016,8,Long-running
EC: Fix datanode exclusion check in client,We should call HddsClientUtils.checkForException before calling checkIfContainerToExclude. This bug was introduced in HDDS-6400.,Major,Sub-task,HDDS,Ozone,42,7,128,13,1,1,1,0.0,1.0,2022,5,Standard
Update some third parties because of CVEs,"Hello, There are several CVEs linked to some third parties embedded like jackson and xmlsec (santuario). Could you update those third parties ? jackson-databind from 2.9.9.3 to 2.9.10 at least-- xmlsec from 2.1.2 to 2.1.4 at least commons-beanutils from 1.9.3 to 1.9.4 (don't know if the latest version fixes any CVE) ... Best Regards.",Major,Improvement,TOMEE,OpenEJB,41,7,335,54,1,0,0,1.0,3.0,2019,11,Short
Extended operation for Notice of DIsconnect (Unsolicited Notification),"From RFC 2251 here Section 4.1.1 (Small snippent on sending NoD) If the server receives a PDU from the client in which the LDAPMessage SEQUENCE tag cannot be recognized, the messageID cannot be parsed, the tag of the protocolOp is not recognized as a request, or the encoding structures or lengths of data fields are found to be incorrect, then the server MUST return the notice of disconnection described in section 4.4.1, with resultCode protocolError, and immediately close the connection. In other cases that the server cannot parse the request received by the client, the server MUST return an appropriate response to the request, with the resultCode set to protocolError. 4.4.1. Notice of Disconnection This notification may be used by the server to advise the client that the server is about to close the connection due to an error condition. Note that this notification is NOT a response to an unbind requested by the client: the server MUST follow the procedures of section 4.3. This notification is intended to assist clients in distinguishing between an error condition and a transient network failure. As with a connection close due to network failure, the client MUST NOT assume that any outstanding requests which modified the directory have succeeded or failed. The responseName is 1.3.6.1.4.1.1466.20036, the response field is absent, and the resultCode is used to indicate the reason for the disconnection. The following resultCode values are to be used in this notification: - protocolError: The server has received data from the client in which the LDAPMessage structure could not be parsed. - strongAuthRequired: The server has detected that an established underlying security association protecting communication between the client and server has unexpectedly failed or been compromised. - unavailable: This server will stop accepting new connections and operations on all existing connections, and be unavailable for an extended period of time. The client may make use of an alternative server. After sending this notice, the server MUST close the connection. After receiving this notice, the client MUST NOT transmit any further on the connection, and may abruptly close the connection.",Major,New Feature,DIRSERVER,Directory,70,8,2209,347,1,0,1,0.0,0.0,2006,1,Long-running
Buildhelper plugin (add source dir) ignored on compile in site phase,"mvn install recognizes additional directories from maven-buildhelper-plugin. Running mvn site afterwards does not recognize the additional src directories. This was not a problem until compiler 3.0 plugin changed the way compilation is done, it now recompiles the project every time even when no changes have been made, unfortunately it needs to recompile during the site phase now. Multiple recompilations normally would not be a problem (though preferred not to have to do), if it found all the source directories. I tested the old 2.5.1 plugin by deleting the target/classes files and then running mvn site, and it fails the same way (additional buildhelper directories not added to compilation path), so this issue also exists in the plugin v2.x. Attached a debug log output, it shows that the buildhelper dirs were added when that plugin was run under 'Source directories' but were not passed to the javac command line when the compiler plugin was run. Running the same under mvn install shows both sourcepath values passed to the javac compiler. I'm hoping there's a simple solution to this, otherwise I'll build the SNAPSHOT version of the compiler-plugin and attempt to troubleshoot (probably easier than duplicating the problem in a very small project). Because it is such a large project, I have to run the install phase separately from the site phase (memory constraints).",Major,Bug,MCOMPILER,Maven,68,11,1383,222,1,0,0,0.0,1.0,2013,6,Long-running
Create release tag,,Major,Sub-task,WOOKIE,Incubator,18,3,0,0,0,0,1,0.0,1.0,2012,5,Standard
Open Form Widget (Single Type) source file from browser,Allow form widget (single type) source file to be opened from the browser.,Minor,Improvement,OFBIZ,OFBiz,55,9,74,13,1,0,1,0.0,3.0,2020,10,Short
Jdbc connector uses postgres testcontainers in compile scope,testcontainer dependencies should only ever be used in the test scope. It has been fixed at least on 1.14 branch (I have not checked on master),Blocker,Bug,FLINK,Flink,60,8,143,26,1,1,1,0.0,1.0,2021,9,Short
[ATSv2] NPE in RM while starting timeline collector on recovery after explicit failover,"{noformat} 2017-07-20 03:20:50,742 ERROR [Thread-449] resourcemanager.ResourceManager (ResourceManager.java:serviceStart(763)) - Failed to load/recover state java.lang.NullPointerException at org.apache.hadoop.yarn.server.resourcemanager.rmapp.RMAppImpl.startTimelineCollector(RMAppImpl.java:535) at org.apache.hadoop.yarn.server.resourcemanager.RMAppManager.createAndPopulateNewRMApp(RMAppManager.java:467) at org.apache.hadoop.yarn.server.resourcemanager.RMAppManager.recoverApplication(RMAppManager.java:336) at org.apache.hadoop.yarn.server.resourcemanager.RMAppManager.recover(RMAppManager.java:576) at org.apache.hadoop.yarn.server.resourcemanager.ResourceManager.recover(ResourceManager.java:1419) at org.apache.hadoop.yarn.server.resourcemanager.ResourceManager$RMActiveServices.serviceStart(ResourceManager.java:758) at org.apache.hadoop.service.AbstractService.start(AbstractService.java:193) at org.apache.hadoop.yarn.server.resourcemanager.ResourceManager.startActiveServices(ResourceManager.java:1178) at org.apache.hadoop.yarn.server.resourcemanager.ResourceManager$1.run(ResourceManager.java:1218) at org.apache.hadoop.yarn.server.resourcemanager.ResourceManager$1.run(ResourceManager.java:1214) at java.security.AccessController.doPrivileged(Native Method) at javax.security.auth.Subject.doAs(Subject.java:422) at org.apache.hadoop.security.UserGroupInformation.doAs(UserGroupInformation.java:1965) at org.apache.hadoop.yarn.server.resourcemanager.ResourceManager.transitionToActive(ResourceManager.java:1214) at org.apache.hadoop.yarn.server.resourcemanager.AdminService.transitionToActive(AdminService.java:319) at org.apache.hadoop.yarn.client.ProtocolHATestBase.explicitFailover(ProtocolHATestBase.java:205) at org.apache.hadoop.yarn.client.ProtocolHATestBase$1.run(ProtocolHATestBase.java:250) {noformat}",Major,Sub-task,YARN,Hadoop,87,13,1825,49,1,0,1,0.0,6.0,2017,7,Standard
Port YARN-7033 NM recovery of assigned resources to branch-3.0/branch-2,,Major,Sub-task,YARN,Hadoop,71,9,0,0,0,0,1,0.0,3.0,2019,1,Long-running
"camel-netty-http: Add maxInitialLineLength, maxChunkSize configuration parameters",Camel Netty HTTP has the option {{maxHeaderSize}} which goes down into {{HttpServerInitializerFactory}} and is used at constructor {{HttpRequestDecoder}}. The other two options {{maxInitialLineLength}} and {{maxChunkSize}} which might be necessary to be configured here are not exposed but would be good if so. Patch is already available: https://github.com/micfra/camel/tree/camel-netty-http-ext-configuration - Pull request follows.,Trivial,Improvement,CAMEL,Camel,81,6,434,51,1,0,1,0.0,1.0,2022,9,Short
java.io.ObjectStreamField.getUnshared() should be isUnshared(),According to the spec there should be an isUnshared() method. There is a getUnshared() method which isn't in the spec so I assume this is an error? Will attach a patch.,Minor,Bug,HARMONY,Retired,62,4,168,31,1,0,1,0.0,0.0,2006,3,Long-running
HBase-Spark Module : TableCatelog doesn't support multiple columns from Single Column family,"Issue: HBase-Spark Module : TableCatelog doesn't supports multiple columns from single column family. Description: Datasource API under HBase-Spark Module having error, which accessing more than 1 columns from same column family. If your catalog having the format where you have multiple columns from single / multiple column family, at that point it throws an exception, for example. def empcatalog = s""""""{ |""table"":{""namespace"":""empschema"", ""name"":""emp""}, |""rowkey"":""key"", |""columns"":{ |""empNumber"":{""cf"":""rowkey"", ""col"":""key"", ""type"":""string""}, |""city"":{""cf"":""pdata"", ""col"":""city"", ""type"":""string""}, |""empName"":{""cf"":""pdata"", ""col"":""name"", ""type"":""string""}, |""jobDesignation"":{""cf"":""pdata"", ""col"":""designation"", ""type"":""string""}, |""salary"":{""cf"":""pdata"", ""col"":""salary"", ""type"":""string""} |} |}"""""".stripMargin Here, we have city, name, designation, salary from pdata column family. Exception while saving Dataframe at HBase. java.lang.IllegalArgumentException: Family 'pdata' already exists so cannot be added at org.apache.hadoop.hbase.HTableDescriptor.addFamily(HTableDescriptor.java:827) at org.apache.spark.sql.execution.datasources.hbase.HBaseRelation$$anonfun$createTable$1.apply(HBaseRelation.scala:98) at org.apache.spark.sql.execution.datasources.hbase.HBaseRelation$$anonfun$createTable$1.apply(HBaseRelation.scala:95) at scala.collection.immutable.List.foreach(List.scala:381) at org.apache.spark.sql.execution.datasources.hbase.HBaseRelation.createTable(HBaseRelation.scala:95) at org.apache.spark.sql.execution.datasources.hbase.DefaultSource.createRelation(HBaseRelation.scala:58) at org.apache.spark.sql.execution.datasources.DataSource.write(DataSource.scala:457) at org.apache.spark.sql.DataFrameWriter.save(DataFrameWriter.scala:211) HBaseTableCatalog.scala class has getColumnFamilies method which returns duplicates, which should not return. Unit test has been written for the same at DefaultSourceSuite.scala, writeCatalog object definition.",Major,Bug,HBASE,Hadoop,92,12,1964,149,1,0,1,0.0,5.0,2017,1,Short
"Situation can occur that causes infinite amount of connection to be opened, causing System.Net.WebSockets.WebSocketException","In the tinkerpop/gremlin-dotnet/src/Gremlin.Net/Driver/ConnectionPool.cs, a bug exists where the connection count locking mechanism logic can create a situation that creates infinite amount of connections to be opened. My suspicion is that its within the while(true) loop within the EnsurePoolIsPopulatedAsync function. I cannot reliably recreate the issue, but since updating from 3.4.0-rc2 to 3.4.0, I've seen this issue happen several times, which cause our hosting environment to run out of socket connections and start throwing: System.IO.IOException: Unable to read data from the transport connection: An existing connection was forcibly closed by the remote host. ---> System.Net.Sockets.SocketException: An existing connection was forcibly closed by the remote host",Critical,Bug,TINKERPOP,Unknown,124,14,773,104,1,0,1,0.0,1.0,2019,2,Standard
Ambari reports grafana service is down when its running causing other services to not start,"On the node grafana is running. {code} # cat /var/run/ambari-metrics-grafana/grafana-server.pid 26593 # ps aux | grep 26593 root 20057 0.0 0.0 5712 824 pts/0 R+ 16:12 0:00 grep 26593 ams 26593 0.0 0.0 102032 12904 ? Sl 01:19 0:11 /usr/lib/ambari-metrics-grafana/bin/grafana-server --pidfile=/var/run/ambari-metrics-grafana/grafana-server.pid --config=/etc/ambari-metrics-grafana/conf/ams-grafana.ini cfg:default.paths.data=/var/lib/ambari-metrics-grafana cfg:default.paths.logs=/var/log/ambari-metrics-grafana {code} How ever after enabling WE when we tried to start all services ambari reported {code} Traceback (most recent call last): File ""/var/lib/ambari-agent/cache/common-services/AMBARI_METRICS/0.1.0/package/scripts/metrics_grafana.py"", line 77, in <module> AmsGrafana().execute() File ""/usr/lib/python2.6/site-packages/resource_management/libraries/script/script.py"", line 313, in execute method(env) File ""/var/lib/ambari-agent/cache/common-services/AMBARI_METRICS/0.1.0/package/scripts/metrics_grafana.py"", line 58, in start create_ams_datasource() File ""/var/lib/ambari-agent/cache/common-services/AMBARI_METRICS/0.1.0/package/scripts/metrics_grafana_util.py"", line 239, in create_ams_datasource response = perform_grafana_get_call(GRAFANA_DATASOURCE_URL, server) File ""/var/lib/ambari-agent/cache/common-services/AMBARI_METRICS/0.1.0/package/scripts/metrics_grafana_util.py"", line 72, in perform_grafana_get_call raise Fail(""Ambari Metrics Grafana update failed due to: %s"" % str(ex)) resource_management.core.exceptions.Fail: Ambari Metrics Grafana update failed due to: [Errno 1] _ssl.c:491: error:1407742E:SSL routines:SSL23_GET_SERVER_HELLO:tlsv1 alert protocol version {code}",Blocker,Bug,AMBARI,Ambari,91,15,1694,130,1,0,1,0.0,2.0,2017,2,Short
[Java] The parsing logic for certificate subjects doesn't work properly in all cases,"The Java code seems to contain two places where the certificate subjects are being parsed. One is used in the client: {{common/src/main/java/org/apache/qpid/transport/network/security/ssl/SSLUtil.java}} and the second is used in the broker: {{broker/src/main/java/org/apache/qpid/server/security/auth/sasl/external/ExternalSaslServer.java}} Both are actually doing the same - extracting the CN and DC components from the subject and creating the username. It should be reconsidered whether we want to reuse the SSLUtil functionality from the common part of the code in the broker code as well. However, a bigger problem is that the implementation in both places are not working correctly in all situations. One can very easily create a certificate with a subject / DN like this: {{C=CZ,O=Scholz,OU=""JAKUB CN=USER1""}} such certificate actually doesn't contain a CN. But both current implementations will still identify the CN as {{USER1""}} in the code. I would expect that this will happen only in very rare cases, but it should still be handled properly.",Minor,Bug,QPID,Qpid,84,13,1054,150,1,0,1,0.0,6.0,2013,5,Long-running
Implement experiment Cancel option,"1. When experiments are in EXECUTING state, they need a Cancel option. 2. The cancel option will cancel the experiment and job",Major,Sub-task,AIRAVATA,Airavata,34,4,126,22,1,0,1,0.0,3.0,2019,7,Standard
Kylin StringUtil.join() may cause NPE if iterator is empty,"{code} public static String join(Iterable<String> parts, String separator) { StringBuilder buf = new StringBuilder(); Iterator<String> iterator = parts.iterator(); if (iterator == null || (!iterator.hasNext())) { return null; } {code} org.apache.kylin.job.exception.ExecuteException: org.apache.kylin.job.exception.ExecuteException: java.lang.NullPointerException at org.apache.kylin.job.execution.AbstractExecutable.execute(AbstractExecutable.java:183) at org.apache.kylin.job.impl.threadpool.DefaultScheduler$JobRunner.run(DefaultScheduler.java:114) at java.util.concurrent.ThreadPoolExecutor.runWorker(ThreadPoolExecutor.java:1149) at java.util.concurrent.ThreadPoolExecutor$Worker.run(ThreadPoolExecutor.java:624) at java.lang.Thread.run(Thread.java:748) Caused by: org.apache.kylin.job.exception.ExecuteException: java.lang.NullPointerException at org.apache.kylin.job.execution.AbstractExecutable.execute(AbstractExecutable.java:183) at org.apache.kylin.job.execution.DefaultChainedExecutable.doWork(DefaultChainedExecutable.java:71) at org.apache.kylin.job.execution.AbstractExecutable.execute(AbstractExecutable.java:168) ... 4 more Caused by: java.lang.NullPointerException at com.google.common.base.Preconditions.checkNotNull(Preconditions.java:191) at com.google.common.base.Splitter.split(Splitter.java:383) at org.apache.kylin.common.util.StringUtil.splitAndTrim(StringUtil.java:181) at org.apache.kylin.source.hive.GarbageCollectionStep.getIntermediateTables(GarbageCollectionStep.java:95) at org.apache.kylin.source.hive.GarbageCollectionStep.cleanUpIntermediateFlatTable(GarbageCollectionStep.java:62) at org.apache.kylin.source.hive.GarbageCollectionStep.doWork(GarbageCollectionStep.java:48) at org.apache.kylin.job.execution.AbstractExecutable.execute(AbstractExecutable.java:168) ... 6 more",Major,Bug,KYLIN,Kylin,58,9,1810,75,1,0,1,0.0,3.0,2019,2,Standard
[PATCH] OOM for tiff output,"fop holds on to last page awt Raster data export FOP_OPTS=""-Xmx50m"" fop test.fo -tiff out.tiff -c fop.xconf Exception in thread ""main"" java.lang.OutOfMemoryError: Java heap space at java.awt.image.DataBufferInt.<init>(DataBufferInt.java:41)",Major,Bug,FOP,Formatting Objects Processor,27,5,240,27,1,0,0,0.0,1.0,2014,2,Long-running
[CI][Nightly] Disable docker layer caching for CircleCI tasks,CircleCI builds are failing because the layer caching is not available for free plans.,Major,Bug,ARROW,Retired,61,8,86,14,1,1,1,0.0,2.0,2019,10,Short
Flatten does not work with nested maps/unions.,"Minimum reproduce : {code} test1.json {""data"": [{""key"":""apple"",""value"":{""cnt"":1}}, {""key"":""orange"",""value"":{""cnt"":2}}] } select flatten(data) from dfs.tmp.`test1.json` as t; +------------+ | EXPR$0 | +------------+ Query failed: Failure while running fragment.[ 7e60b3fe-198d-4bc5-b440-e6f7a15cc54f on n3a:31010 ] (java.lang.UnsupportedOperationException) org.apache.drill.exec.vector.complex.MapVector$MapTransferPair.splitAndTransfer():284 org.apache.drill.exec.vector.complex.RepeatedMapVector$SingleMapTransferPair.splitAndTransfer():305 org.apache.drill.exec.test.generated.FlattenerGen80.flattenRecords():106 org.apache.drill.exec.physical.impl.flatten.FlattenRecordBatch.doWork():155 org.apache.drill.exec.record.AbstractSingleRecordBatch.innerNext():89 org.apache.drill.exec.physical.impl.flatten.FlattenRecordBatch.innerNext():121 org.apache.drill.exec.record.AbstractRecordBatch.next():106 org.apache.drill.exec.physical.impl.validate.IteratorValidatorBatchIterator.next():124 org.apache.drill.exec.record.AbstractRecordBatch.next():86 org.apache.drill.exec.record.AbstractRecordBatch.next():76 org.apache.drill.exec.record.AbstractSingleRecordBatch.innerNext():52 org.apache.drill.exec.physical.impl.project.ProjectRecordBatch.innerNext():129 org.apache.drill.exec.record.AbstractRecordBatch.next():106 org.apache.drill.exec.physical.impl.validate.IteratorValidatorBatchIterator.next():124 org.apache.drill.exec.physical.impl.BaseRootExec.next():67 org.apache.drill.exec.physical.impl.ScreenCreator$ScreenRoot.innerNext():122 org.apache.drill.exec.physical.impl.BaseRootExec.next():57 org.apache.drill.exec.work.fragment.FragmentExecutor.run():113 org.apache.drill.exec.work.WorkManager$RunnableWrapper.run():249 .......():0 java.lang.RuntimeException: java.sql.SQLException: Failure while executing query. at sqlline.SqlLine$IncrementalRows.hasNext(SqlLine.java:2514) at sqlline.SqlLine$TableOutputFormat.print(SqlLine.java:2148) at sqlline.SqlLine.print(SqlLine.java:1809) at sqlline.SqlLine$Commands.execute(SqlLine.java:3766) at sqlline.SqlLine$Commands.sql(SqlLine.java:3663) at sqlline.SqlLine.dispatch(SqlLine.java:889) at sqlline.SqlLine.begin(SqlLine.java:763) at sqlline.SqlLine.start(SqlLine.java:498) at sqlline.SqlLine.main(SqlLine.java:460) {code}",Critical,Bug,DRILL,Drill,46,7,2272,76,1,0,1,0.0,5.0,2014,11,Standard
ResourceOwnerGrantHandler: ResourceOwnerLoginHandler can't return null or throw exception,"ResourceOwnerGrantHandler calls a customisable ResourceOwnerLoginHandler instance, however the `createSubject(String, String)` method declares no exceptions, and a null return value is not handled. This can possibly result in the issuing of an access token if the DataProvider doesn't check for the null subject. ResourceOwnerGrantHandler.createAccessToken(...) appears to expect that the ResourceOwnerLoginHandler will throw an `Exception` (literally any Exception), however the method signature of the ResourceOwnerLoginHandler interface doesn't allow that. I will submit a pull request with a suggested fix.",Major,Bug,CXF,CXF,89,8,610,77,1,0,1,0.0,3.0,2015,8,Short
Create Batch Spike for Elastic Search (Todd),,Major,Story,USERGRID,Retired,44,7,0,0,0,0,1,0.0,1.0,2015,2,Standard
Analyze and Optimize Ambari Server Unit Tests - Group 3,||Test||Count||Time (s)|| |org.apache.ambari.server.security.authorization.TestUsers|31|50.4| |org.apache.ambari.server.upgrade.UpgradeCatalog210Test |18|46.497| |org.apache.ambari.server.state.svccomphost.ServiceComponentHostTest|15|43.899| |org.apache.ambari.server.serveraction.upgrades.UpgradeActionTest|9|35.136| |org.apache.ambari.server.agent.TestHeartbeatMonitor|6|28.146|,Major,Task,AMBARI,Ambari,55,10,380,8,1,0,1,0.0,2.0,2016,9,Short
Facet count not working when tagging & excluding filters for query facets with group.facet true,"{noformat} q=*:*& rows=0& facet=true& facet.field={!ex=code}ssis_program_code& facet.query={!ex=code}*:*& fq={!tag=code}ssis_program_code:TKITE& group=true& group.facet=true& group.field=ssis_course_id {noformat} Unfortunately, the facet.query returns the number of hits *after* the filter query has been applied. The exclusion works if I remove the group parameters. But then of course the counts are number of documents, not number of groups.",Major,Bug,SOLR,Lucene,95,15,444,49,1,0,0,0.0,1.0,2013,3,Short
Improper Authentication in Apache Shiro,Vulnerability in shiro-core-1.4.0 Need to update to shiro 1.10 or greater. [https://github.com/advisories/GHSA-pc4w-8v5j-29w9|https://github.com/advisories/GHSA-72w9-fcj5-3fcg],Major,Improvement,TINKERPOP,Unknown,39,5,176,12,1,1,0,0.0,1.0,2023,2,Standard
Clarify remote repository resolution order,"It is possible to declare remote repositories in {{settings.xml}} and {{pom.xml}}. While for the {{settings.xml}} it has to be given in a profile, for {{pom.xml}} it can be given in the top-level {{repositories}} element as well as in profiles. The order in which an artifact is tried to be resolved from the different remote repo is sometimes crucial to know (e.g. to speed up build times by first checking against remote repos having most of the artifacts like Maven Central) It would be nice to document this in https://maven.apache.org/guides/introduction/introduction-to-repositories.html",Major,Improvement,MNGSITE,Maven,42,5,593,89,1,0,1,0.0,4.0,2020,10,Standard
